{
  "$schema": "urn:openaix:schema:measure-misarc:0.1.0-draft.2",
  "active": {
    "end": "2026-10-02T14:00:00Z",
    "start": "2026-10-02T13:40:00Z"
  },
  "altitude": {
    "lower": {
      "surface": true
    },
    "upper": {
      "reference": "FL",
      "unit": "flight_level",
      "value": 450
    }
  },
  "axis": {
    "reference": "true",
    "value": 45
  },
  "center": {
    "latitude": 34.35,
    "longitude": 34.4
  },
  "description": "Missile arc from the Kestrel destroyer toward an inbound target track from the north-east.",
  "firing_unit": "Kestrel (Arleigh Burke-class destroyer)",
  "id": "kestrel-misarc",
  "name": "Kestrel missile arc",
  "range": {
    "unit": "nm",
    "value": 30
  },
  "type": "MISARC",
  "width_deg": 10
}
